ID;title;author;stock;price;currency;description;criticality
1;Sefiller;Victor Hugo;100;29.99;TRY;19. yuzyil Fransa'sinda toplumsal adaletsizlik uzerine bir basyapit.;3
2;Ince Memed;Yashar Kemal;150;19.99;TRY;Anadolu'da toprak agalarina karsi mucadele eden bir eşkiyanin hikayesi.;3
3;Kuyucakli Yusuf;Sabahattin Ali;200;14.99;TRY;Kucuk bir kasabada buyuyen yetim bir cocugun trajik hayat hikayesi.;3
4;Tutunamayanlar;Oguz Atay;8;24.99;TRY;Turkiye'nin ilk postmodern romani. Aydinlarin toplumla iliskisi.;1
5;Huzur;Ahmet Hamdi Tanpinar;120;22.99;TRY;Istanbul'un ruhu ve bir ask hikayesi uzerinden kultur catismasi.;3
6;Aylak Adam;Yusuf Atilgan;45;17.99;TRY;Istanbul sokaklarinda anlam arayan yalniz bir insanin ic dunyasi.;2
7;Bereketli Topraklar Uzerinde;Orhan Kemal;90;21.99;TRY;Cukurova'ya goc eden uc isçinin hikayesi.;3
8;Saatleri Ayarlama Enstitusu;Ahmet Hamdi Tanpinar;15;27.99;TRY;Dogu-Bati sentezi uzerine hicivli bir basyapit.;1
